{
  "$schema": "https://json-schema.org/draft/2020-12/schema",
  "title": "Engineering Harness pack",
  "type": "object",
  "properties": {
    "schema_version": {
      "const": 1
    },
    "id": {
      "type": "string",
      "pattern": "^[a-z0-9]+(?:-[a-z0-9]+)*$",
      "maxLength": 64
    },
    "version": {
      "type": "string",
      "pattern": "^[0-9]+\\.[0-9]+\\.[0-9]+$"
    },
    "description": {
      "type": "string",
      "minLength": 1
    },
    "skills": {
      "type": "array",
      "items": {
        "type": "object",
        "properties": {
          "name": {
            "type": "string",
            "pattern": "^[a-z0-9]+(?:-[a-z0-9]+)*$",
            "maxLength": 64
          },
          "path": {
            "type": "string",
            "minLength": 1,
            "pattern": "^(?!/)(?!.*(?:^|/)\\.\\.(?:/|$)).+$"
          }
        },
        "required": [
          "name",
          "path"
        ],
        "additionalProperties": false
      }
    },
    "standards": {
      "type": "array",
      "items": {
        "type": "string",
        "minLength": 1,
        "pattern": "^(?!/)(?!.*(?:^|/)\\.\\.(?:/|$)).+$"
      },
      "uniqueItems": true
    },
    "workflows": {
      "type": "array",
      "items": {
        "type": "string",
        "minLength": 1,
        "pattern": "^(?!/)(?!.*(?:^|/)\\.\\.(?:/|$)).+$"
      },
      "uniqueItems": true
    },
    "checks": {
      "type": "array",
      "items": {
        "type": "object",
        "properties": {
          "id": {
            "type": "string",
            "pattern": "^[a-z0-9]+(?:-[a-z0-9]+)*$",
            "maxLength": 64
          },
          "description": {
            "type": "string",
            "minLength": 1
          },
          "argv": {
            "type": "array",
            "items": {
              "type": "string",
              "minLength": 1,
              "pattern": "^[^\u0000]+$"
            },
            "minItems": 1
          },
          "project_command": {
            "type": "string",
            "pattern": "^[a-z0-9]+(?:-[a-z0-9]+)*$",
            "maxLength": 64
          },
          "cwd": {
            "enum": [
              "project",
              "pack"
            ]
          },
          "cwd_subdir": {
            "type": "string",
            "minLength": 1,
            "pattern": "^(?!/)(?!.*(?:^|/)\\.\\.(?:/|$)).+$"
          },
          "timeout_seconds": {
            "type": "integer",
            "minimum": 1,
            "maximum": 86400
          }
        },
        "required": [
          "id",
          "description",
          "cwd",
          "timeout_seconds"
        ],
        "additionalProperties": false,
        "oneOf": [
          {
            "required": [
              "argv"
            ],
            "not": {
              "required": [
                "project_command"
              ]
            }
          },
          {
            "required": [
              "project_command"
            ],
            "not": {
              "required": [
                "argv"
              ]
            }
          }
        ]
      }
    },
    "templates": {
      "type": "array",
      "items": {
        "type": "string",
        "minLength": 1,
        "pattern": "^(?!/)(?!.*(?:^|/)\\.\\.(?:/|$)).+$"
      },
      "uniqueItems": true
    },
    "tools": {
      "type": "array",
      "items": {
        "type": "string",
        "minLength": 1,
        "pattern": "^(?!/)(?!.*(?:^|/)\\.\\.(?:/|$)).+$"
      },
      "uniqueItems": true
    },
    "compatibility": {
      "type": "object",
      "properties": {
        "harness_schema": {
          "const": 1
        },
        "runtimes": {
          "type": "array",
          "items": {
            "enum": [
              "codex",
              "claude"
            ]
          },
          "minItems": 1,
          "uniqueItems": true
        },
        "platforms": {
          "type": "array",
          "items": {
            "enum": [
              "darwin",
              "linux"
            ]
          },
          "minItems": 1,
          "uniqueItems": true
        }
      },
      "required": [
        "harness_schema",
        "runtimes",
        "platforms"
      ],
      "additionalProperties": false
    },
    "reviewers": {
      "type": "array",
      "items": {
        "type": "object",
        "properties": {
          "id": {
            "type": "string",
            "pattern": "^[a-z0-9]+(?:-[a-z0-9]+)*$",
            "maxLength": 64
          },
          "path": {
            "type": "string",
            "minLength": 1,
            "pattern": "^(?!/)(?!.*(?:^|/)\\.\\.(?:/|$)).+$"
          }
        },
        "required": [
          "id",
          "path"
        ],
        "additionalProperties": false
      }
    }
  },
  "required": [
    "schema_version",
    "id",
    "version",
    "description",
    "skills",
    "standards",
    "workflows",
    "checks",
    "compatibility"
  ],
  "additionalProperties": false
}
